ticker,date,text,source,url,news_status
INSM,2026-05-02,"Raymond James Starts Insmed (INSM) at Outperform, Citing Limited Competition. Insmed Incorporated (NASDAQ:INSM) is one of the Stocks that Billionaire Druckenmiller and Jim Cramer like. On April 9, 2026, Raymond James initiated coverage of Insmed Incorporated (NASDAQ:INSM) with an Outperform rating. The firm’s analyst set a price target of $200 on the stock. According to the analyst’s research note, the early launch of Brinsupri has […]",Yahoo,https://finnhub.io/api/news?id=a1644e3a15da99b710000dc56a6e8ee8d3e90e5e3f36ab5267c00b3308d5bc41,supabase
INSM,2026-05-02,"Vanguard’s Larger Passive Stake Puts Insmed’s Volatile Story In Focus. Vanguard Capital Management has reported an increased passive ownership stake in Insmed (NasdaqGS:INSM) through a Schedule 13G filing. The disclosure signals higher institutional involvement in the company and updates the public record on Insmed's shareholder base. Insmed, trading on the NasdaqGS under the ticker INSM, recently closed at $133.26. The share price reflects a mixed return profile, with a 1 year gain of 84.3% alongside a 24.8% decline year to date and a 19.2% decline over the",Yahoo,https://finnhub.io/api/news?id=7fa6e89d403476880a73a2a5e3cb8b6bb2f63c3793271d09ce72413614714e3e,supabase
INSM,2026-05-04,"Stock Market Today: Dow Drops On U.S.-Iran News; Oil Prices Continue To Rally (Live Coverage). Stock Market Today: The Dow Jones index dropped Monday on the latest U.S.-Iran news. Oil prices continued to rally, topping $105 a barrel",Yahoo,https://finnhub.io/api/news?id=84f3b474cbc0dc4c87671fb0af7f113a2d06009aaafe63b32c6c171c99a5e0fd,supabase
INSM,2026-05-04,"Insmed to Present Data Across Its Respiratory Portfolio, Including Late-Breaking ARIKAYCE® Results from Phase 3b ENCORE Study, at the American Thoracic Society International Conference 2026. Insmed Incorporated (Nasdaq: INSM), a people-first global biopharmaceutical company striving to deliver first- and best-in-class therapies to transform the lives of patients facing serious diseases, today announced that it will present six abstracts from across its respiratory portfolio and pipeline at the American Thoracic Society International Conference 2026 (ATS 2026), taking place May 17–20 in Orlando, Florida",Yahoo,https://finnhub.io/api/news?id=81840df8c33c73233c61576e9c530f23d9247bf4c6448b489beeeabb3dac1aab,supabase
INSM,2026-05-04,Insmed To Showcase Respiratory Portfolio At ATS 2026 With Late-Breaking ARIKAYCE ENCORE Study And BRINSUPRI ASPEN Trial Data. —New Data in Non-Cystic Fibrosis Bronchiectasis Further Define Impact of BRINSUPRI® on Respiratory Symptoms——Findings from a Pharmacokinetic Study Continue to Support Further Evaluation of Treprostinil Palmitil,Benzinga,https://finnhub.io/api/news?id=5894a2f6a1a8847a5a47958b40a51fdf739253d08a596377957fc87cf756b0d8,supabase
INSM,2026-05-06,"Insmed and Ty Pennington Team Up to Drive Awareness and Proper Diagnosis of Bronchiectasis. Insmed Incorporated (Nasdaq: INSM), a people-first global biopharmaceutical company striving to deliver first- and best-in-class therapies to transform the lives of patients facing serious diseases, today announced a collaboration with Emmy® Award–winning TV host, designer, and carpenter, Ty Pennington, to launch Suspect Bronchiectasis (Suspect BE). The educational initiative focuses on increasing awareness and proper diagnosis of bronchiectasis, a serious and chronic lung disease that may worse",Yahoo,https://finnhub.io/api/news?id=6dbcf7b5c0a33f8538ef73837759a4bc99c957d03eac81a9501a02f4a667d974,supabase
INSM,2026-05-06,"Avalo shares spike on skin drug data; BioNTech to cut staff. Avalo reported study success in what’s proven to be a tough-to-treat skin disease. Elsewhere, BioNTech announced plans to close multiple plants and Madrigal picked up an RNA-based drug for MASH",Yahoo,https://finnhub.io/api/news?id=71335b29ef3774944d026975fe31607fb5b23e801aabb6cc2bb241005a18c36c,supabase
INSM,2026-05-07,"Insmed Q1 EPS $(0.76) Beats $(0.97) Estimate, Sales $305.964M Beat $303.298M Estimate. Insmed (NASDAQ:INSM) reported quarterly losses of $(0.76) per share which beat the analyst consensus estimate of $(0.97) by 21.65 percent. This is a 46.48 percent increase over losses of $(1.42) per share from the same",Benzinga,https://finnhub.io/api/news?id=4cb2a53ce5324c91e8ecd3be8135c502fa69baddf13ae3b5be89bb5ef030d458,supabase
INSM,2026-05-07,"Insmed: Q1 Earnings Snapshot. BRIDGEWATER, N.J. — BRIDGEWATER, N.J. — Insmed Inc. on Thursday reported a loss of $163.6 million in its first quarter. The Bridgewater, New Jersey-based company said it had a loss of 76",Finnhub,https://finnhub.io/api/news?id=abdec94896d9eafec6047c74ec0df516a3f085cc20a4b096aa79775e498cfe43,supabase
INSM,2026-05-07,Insmed Affirms FY2026 Sales Guidance of $1.450B-$1.470B vs $1.699B Est. Insmed (NASDAQ:INSM) affirms FY2026 sales outlook from $1.450 billion-$1.470 billion to $1.450 billion-$1.470 billion vs $1.699 billion estimate,Benzinga,https://finnhub.io/api/news?id=2bbf3b5e35fcf5a9b8b52477c1a315d0255a46d75f0041c4d0d794c5ff8d7ff4,supabase
INSM,2026-05-07,"Transcript : Insmed Incorporated, Q1 2026 Earnings Call, May 07, 2026. Presentation Operator MessageOperator Thank you for standing by. My name is Danica, and I will be your conference operator today. At this time, I would like to welcome everyone to the Insmed First",Finnhub,https://finnhub.io/api/news?id=d4b587ee5ba9e1209268b02bd80214b3117b373ca4b4bc44c4ba5bd33cf57714,supabase
INSM,2026-05-07,"Insmed Incorporated Reports Earnings Results for the First Quarter Ended March 31, 2026. Insmed Incorporated reported earnings results for the first quarter ended March 31, 2026. For the first quarter, the company reported net loss was USD 163.56 million compared to USD 256.58 million a",Finnhub,https://finnhub.io/api/news?id=0071ac9d97475bef22bcdbe8e46d79c014af5c0a498aeadeb9bb5334c4f31290,supabase
INSM,2026-05-07,"Insmed Reports First-Quarter 2026 Financial Results and Provides Business Update. Insmed Incorporated (Nasdaq: INSM), a people-first global biopharmaceutical company striving to deliver first- and best-in-class therapies to transform the lives of patients facing serious diseases, today reported financial results for the first quarter ended March 31, 2026, and provided a business update",Yahoo,https://finnhub.io/api/news?id=81bc59a156d973de1adc1fdc9bf51a9f8bfc382485643759a575f70d943ae5e8,supabase
INSM,2026-05-07,"Insmed (NASDAQ:INSM) Q1 Revenue Miss Triggers Pre-Market Slide Despite Narrower Loss. Insmed (INSM) Q1 2026 revenue of $306M missed estimates, but EPS loss of -$0.76 beat forecasts. Stock falls 6.6% pre-market despite BRINSUPRI's 44% sequential growth",ChartMill,https://finnhub.io/api/news?id=3120fd242fc4b6967dab845351851c7a614242cdf8b12023dca8c4d823af06d7,supabase
INSM,2026-05-07,"Nasdaq 100 Climbs Records, Oil Extends Drop As Iran Weighs Hormuz Deal: Stock Market Today. U.S. stocks drifted near records Thursday as oil slipped on Iran-Hormuz peace hopes. Coinbase, Airbnb and CoreWeave on deck after the close",Benzinga,https://finnhub.io/api/news?id=52fcc9d5ae47d661e3ad963c59ce552f449c588fc1e635f5a1940025deb2be74,supabase
INSM,2026-05-07,"Insmed (INSM) Reports Q1 Loss, Misses Revenue Estimates. Insmed (INSM) delivered earnings and revenue surprises of +15.86% and -0.70%, respectively, for the quarter ended March 2026. Do the numbers hold clues to what lies ahead for the stock?",Yahoo,https://finnhub.io/api/news?id=6bf36ffff02f2c56c398b40f89222fb5bf1a04e4c83f47594fbdca0ae61c7eba,supabase
INSM,2026-05-07,Stock Market Today: Dow Edges Higher After Jobless Claims; AI Stock Dives On Earnings (Live Coverage). Stock Market Today: The Dow Jones index rose Thursday after weekly jobless claims. AI stock Arm dived on earnings,Yahoo,https://finnhub.io/api/news?id=7a5849fb3245ab08f71fd71e58db69e92743f9a192c8cf3877e6be122c3cd341,supabase
INSM,2026-05-07,Insmed Incorporated 2026 Q1 - Results - Earnings Call Presentation. 2026-05-07. The following slide deck was published by Insmed Incorporated in conjunction with their 2026 Q1 earnings call,SeekingAlpha,https://finnhub.io/api/news?id=887b16b4fac52add76be41a94efe3045866068723682bf11142be70cf1b51daf,supabase
INSM,2026-05-07,"Insmed Incorporated (INSM) Q1 2026 Earnings Call Transcript. Insmed Incorporated (INSM) Q1 2026 Earnings Call May 7, 2026 8:00 AM EDTCompany ParticipantsBryan Dunn - Vice President of Investor RelationsWilliam Lewis -",SeekingAlpha,https://finnhub.io/api/news?id=ef8034a17184d87deec47fdae98c7ca153a323bd6f114a0de1267305ac6ac9a7,supabase
INSM,2026-05-07,"Insmed Tanks On Its Most Important Launch; Why Analysts Remain Bullish. Insmed stock tanked Thursday after its new lung drug, Brinsupri, missed elevated buy-side expectations, though beat sell-side views",Yahoo,https://finnhub.io/api/news?id=fffd4c8c5d83c33049506b4683d4f6ed36a7ea55848e6bc62351c4ab9b3fda3b,supabase
INSM,2026-05-07,Insmed Incorporated Q1 2026 Earnings Call Summary. Moby summary of Insmed Incorporated's Q1 2026 earnings call,Yahoo,https://finnhub.io/api/news?id=7b16350c9ba5f93a5fb8c2bb783544040eac6114cd5cfce179591a616ed8f582,supabase
INSM,2026-05-08,"Insmed Stock Sell-off is Overdone as Underlying Metrics Appear Positive, RBC Says. Insmed (INSM) stock sell-off post Q1 results is overdone as underlying metrics appear positive and p",Yahoo,https://finnhub.io/api/news?id=29fd5df51e4c3cb5c7a82d364d5d2d2e6fdd63ca4136615e44e27ea42dc7bd4c,supabase
INSM,2026-05-08,"Insmed's Q1 Earnings Beat, Sales Miss Estimates, Stock Tanks 23%. INSM stock plunges 23% after Q1 sales miss estimates despite 230% revenue growth and strong Brinsupri uptake",Yahoo,https://finnhub.io/api/news?id=0000c50c3ff3c2475519d604c7c42a78e67ada36f3ab0099fd2e72ff4c90eb96,supabase
INSM,2026-05-08,"RBC Capital Maintains Outperform on Insmed, Lowers Price Target to $205. RBC Capital  analyst Leonid Timashev   maintains Insmed (NASDAQ:INSM) with a Outperform and lowers the price target from $220 to $205",Benzinga,https://finnhub.io/api/news?id=fae049b7265984d16307642f0888fb11a562ad6eb5d4d40b98157e7bcd77f75d,supabase
INSM,2026-05-08,"US Stock Market Today: S&P 500 Futures Climb As Traders Weigh Jobs And Inflation. The Morning Bull - US Market Morning Update Friday, May, 8 2026 US stock futures are pointing higher this morning, with E-mini S&P 500 contracts up about 0.4% and Nasdaq-100 futures up roughly 0.6%, as investors focus on a key mix of jobs and inflation signals. The April non-farm payrolls report is expected to show 62,000 new jobs, unemployment at 4.3% and paychecks rising 0.3% month on month, which hints at an economy that is cooling but still holding up. At the same time, global food prices",Yahoo,https://finnhub.io/api/news?id=ec1edde090d2d5405cd1f3e6ebf586fc439916f37af5d797b80361729a820a1b,supabase
INSM,2026-05-08,"Wells Fargo Maintains Overweight on Insmed, Lowers Price Target to $160. Wells Fargo  analyst Benjamin Burnett   maintains Insmed (NASDAQ:INSM) with a Overweight and lowers the price target from $177 to $160",Benzinga,https://finnhub.io/api/news?id=82f090987d9ac52fc6949b8a00cc6e20a23fd28d49d5f98c8277ea59fac40da6,supabase
INSM,2026-05-08,"Guggenheim Maintains Buy on Insmed, Lowers Price Target to $226. Guggenheim  analyst Vamil Divan   maintains Insmed (NASDAQ:INSM) with a Buy and lowers the price target from $230 to $226",Benzinga,https://finnhub.io/api/news?id=8d7c414b126d764f5f307e3d761486035777cf67816147b1788eb58f655052d1,supabase
INSM,2026-05-08,"Insmed Q1 Earnings Call Highlights. Insmed (NASDAQ:INSM) executives said the company entered 2026 with strong commercial momentum for BRINSUPRI and continued growth for ARIKAYCE, while advancing late-stage development of TPIP across multiple Phase III studies. Management reiterated full-year guidance for both commercial products and s",Yahoo,https://finnhub.io/api/news?id=dde2aa9cdb6eb325b87e6a7028515720f980184e8c92500dd36d874026aef021,supabase
